{
  "schema_version": "final-inspection-checklist-v1",
  "inspected_snapshot": "03b63be26b7837f642e4af262b2b344f323b3517",
  "recorded_at": "2026-10-10",
  "substantive_inputs": [
    {
      "path": ".gitattributes",
      "sha256": "6454f044c21b3bbc57316237b22a9f4e4e897cf52126da67c498f97702a8b45d"
    },
    {
      "path": ".github/ISSUE_TEMPLATE/source-display-correction.yml",
      "sha256": "1578294ad53d541759f8f2ec02c33a073dbb557b66aca2d011eff20294306884"
    },
    {
      "path": ".github/workflows/capture-current.yml",
      "sha256": "4e92dfbbe1051cbfa634011baf3722be961975d0486ee6d2a6f99520afed7faf"
    },
    {
      "path": ".github/workflows/dbt-fixture.yml",
      "sha256": "d5fc6f8b4a70020d8882d56b1f19258453e86b53f97b29e891f1cea8e84acfe3"
    },
    {
      "path": ".github/workflows/hosted-replay.yml",
      "sha256": "af626112be79b8bc2f5d7f9f55997495c9616e721d641c1e6937e1f26e0811b8"
    },
    {
      "path": ".github/workflows/privacy-gate.yml",
      "sha256": "ba5b7425fb610a0371ad3f84439744c6aed501d6c6408491078817a319caab7c"
    },
    {
      "path": ".github/workflows/publication-route.yml",
      "sha256": "c3ddaf7be1dc2193746f25055061979a6aee67d44331c1388f222857c5e2de43"
    },
    {
      "path": ".gitignore",
      "sha256": "5f5578de04d425b44f4dc1a72f4b93d0c699f9fffa12e86e2e8cc17489848b9f"
    },
    {
      "path": ".python-version",
      "sha256": "861b3dd8083d28f336ef70f6755bc399538ddad627b1d095820ca34cb953cf14"
    },
    {
      "path": "AGENTS.md",
      "sha256": "328c00e8ae17ee3c12b359d7b550329de53ca129d5cdfa641bd02717ed3272c3"
    },
    {
      "path": "CLAUDE.md",
      "sha256": "ded87a785c65e3ffda4c3617f5ae3a7b0c78d6180d6a5a1d417c36bda54b19fd"
    },
    {
      "path": "LICENSE",
      "sha256": "4388396b8e438f61709eb6fc8136029f4299b688bf1a3bfcb3988103709a50a0"
    },
    {
      "path": "README.md",
      "sha256": "10c11f0459ebac08f99c1ee2849904d1bf6e6c3be09377dc6cfb530aaa73090a"
    },
    {
      "path": "calico_capture/__init__.py",
      "sha256": "6c474c6121d73c7aaf66db9c7173be720ca1a53210c37d4cc570b39221597dff"
    },
    {
      "path": "calico_capture/__main__.py",
      "sha256": "0f6033df078b0817f28c71cab104afb540b4b15848b8b95f5ecb762556f2bb7d"
    },
    {
      "path": "calico_capture/archive.py",
      "sha256": "9d9f01963a644309c3d94f5fb79a2979fed9783d9f0781038097ec3cf65a6546"
    },
    {
      "path": "calico_capture/b2.py",
      "sha256": "55f56cbc1cab447315a6e1ecd001272d29757aa2abb4493e2d9f78e823e70fb7"
    },
    {
      "path": "calico_capture/calendar.py",
      "sha256": "9160c9bdbff305ad4bd4228e51a4f91dcec409b3bca0e6e49ef7af891ba537f4"
    },
    {
      "path": "calico_capture/cli.py",
      "sha256": "e8a2ea475eb92c2e84a0235630b07cc1f034f7505c1ae66c37d1862893ab71bb"
    },
    {
      "path": "calico_capture/orchestrator.py",
      "sha256": "0c06cb9acc54b59886eee26a168b520d7096379c6c3b4a467fbe0b9745e72b53"
    },
    {
      "path": "calico_capture/private_policy.py",
      "sha256": "d59cab0ff656f2c0a5cb39984b1798e4b14847b9b7cdca51f5c62af5163b3737"
    },
    {
      "path": "calico_capture/restore.py",
      "sha256": "760488c2e96e460bb19db74026f186f7a2e744b22863a468d683af86db15fcab"
    },
    {
      "path": "calico_capture/runner.py",
      "sha256": "bf0fbbe10ee895c8c3bde0ea4db52a2e78cc259e6abafa5f7c6d9dcbe289346f"
    },
    {
      "path": "calico_capture/source.py",
      "sha256": "a44d0e73523ebebc613f84abd47f790e7181a56c1c82eeb874228665bc82d117"
    },
    {
      "path": "calico_capture/status.py",
      "sha256": "edeacf8488507bc566f4b3ef17add40b409fed17517328e3acc16d38ee43a36e"
    },
    {
      "path": "calico_dbt/__init__.py",
      "sha256": "fd0659d82778d93302d3c52d9e72435395d2670f68d97594385c4e89cc6bc123"
    },
    {
      "path": "calico_dbt/__main__.py",
      "sha256": "d0e22a452845483e45d202e722fbe201fca8bca2ea7354cd0e056c16c29a875f"
    },
    {
      "path": "calico_dbt/catalog.py",
      "sha256": "e12916e78920e703a3a58fb61f4ffa2b9b5fe9380f910bc1cb1180beb1927c21"
    },
    {
      "path": "calico_dbt/eligibility.py",
      "sha256": "34445c5a56f2ca2a279b53b9518b54bb1405581dce5d771e61b8734ea315e909"
    },
    {
      "path": "calico_dbt/preflight.py",
      "sha256": "f8064b8d7d2f090d9844edc7893ba9ff0f2d41b14bea6c3b3e1114fc567b73f8"
    },
    {
      "path": "calico_dbt/runner.py",
      "sha256": "cd28b9d716173c824e1f2657b8675f2a7ead66477c0c6cb4aab1fd9cedf20617"
    },
    {
      "path": "calico_landing/__init__.py",
      "sha256": "8b20628a47ba075d3c9d3c959a16f9620e623ff0509f58d403158bbcf537c0dd"
    },
    {
      "path": "calico_landing/__main__.py",
      "sha256": "bcafb83264349df621a494db5fc1934951e85fe37da9c193641f079d7f42091e"
    },
    {
      "path": "calico_landing/admission.py",
      "sha256": "f71b7347e9fc409b6b65bbf3b4e6fb6af3bb1dce14647d5ddd76c7bd8598b9a5"
    },
    {
      "path": "calico_landing/attempts.py",
      "sha256": "38c4075c95906e3161255dc7285c24905785ff556c4ac3c6906e72480a5f6472"
    },
    {
      "path": "calico_landing/candidate.py",
      "sha256": "0903d2f4ad079c700d7bedd4ac3940864df98d553536fa8c59b2bc22a4dc7a53"
    },
    {
      "path": "calico_landing/cli.py",
      "sha256": "91b599aeb0c1efcf498087f7f5bac3613fac688dfbcd5319fc1d8d9ba81cea30"
    },
    {
      "path": "calico_landing/contracts.py",
      "sha256": "2fa2f7e83b27bc2560a724bf05b0466a1d7aec21f82319b9b536ff25d9092b14"
    },
    {
      "path": "calico_landing/parquet.py",
      "sha256": "45b8be339eb98c06ff186140d6a937942823f70a956e125a175348f1251b1b93"
    },
    {
      "path": "calico_landing/parser.py",
      "sha256": "83186dbe404312cf0b93bc27ce79f780e082549b3da5672081f93a3b0e3dcc11"
    },
    {
      "path": "calico_landing/result.py",
      "sha256": "8f3b7e4620b20f19c0c83cb4afd2a50f416df87ff5793f311436dddc7556542b"
    },
    {
      "path": "calico_landing/store.py",
      "sha256": "997ef2c3039cb20d64121d5bd591bc90ca41c778918055d834dc3e4537090e49"
    },
    {
      "path": "calico_landing/validation.py",
      "sha256": "cb26431cf85d945f4c2677cc73aaf16b98c1984022009c3da58c13d0ccce316a"
    },
    {
      "path": "calico_publish/__init__.py",
      "sha256": "bb8c06e978f330b27d253ed4df3e5c76b9e5931944f5e2789b47bae1e68fe7d0"
    },
    {
      "path": "calico_publish/__main__.py",
      "sha256": "6636db48d004bf5a1bdd1f025090913a7e9af98597f3275ca87eca4394ae89a1"
    },
    {
      "path": "calico_publish/allowlist.py",
      "sha256": "2b466bbc49d2aa8b00cbc14bc473fbe80f108417610259b93ead641d8ba6eb51"
    },
    {
      "path": "calico_publish/cli.py",
      "sha256": "ccb179f42bc40a38745b7cc3b07119fa1e9c078a3546d26fe44a94b36182c9b8"
    },
    {
      "path": "calico_publish/export.py",
      "sha256": "537530e6bab27a64097ff4d066cd931bf64b69bf5fdc6604a04f7d327cc4f9bf"
    },
    {
      "path": "calico_publish/gate.py",
      "sha256": "b77c5f53025f6837512af017217d8535bdb737d43ae9cfc39fa177e2ca648976"
    },
    {
      "path": "calico_publish/inventory.py",
      "sha256": "ef789dd45bae6b152875e44160833402201af6aa946d51826dc21490b4ef5e15"
    },
    {
      "path": "calico_publish/manifest.py",
      "sha256": "31d3fd37687b8904cd1c03e0c2c811694d006734f27601b1591d06ecc68569b3"
    },
    {
      "path": "calico_publish/tmdl_inventory.py",
      "sha256": "6b661f53b3ff7968d38c41d3ae67029401a1bed8e2d130c644a505ef45a171f2"
    },
    {
      "path": "calico_publish/transaction.py",
      "sha256": "abef8eb7499b95c3a1b658fced1e9865d03a9be41823ca58450e29356dcf4321"
    },
    {
      "path": "contracts/admission-result-v1.schema.json",
      "sha256": "ef37b637c9efb85f227372576be22b4578acceecb06a2c473ecd4e562e9b6007"
    },
    {
      "path": "contracts/ag-registry-csv-v1.json",
      "sha256": "871e0dff938ca5f5d4fbe6871a9dcde539f5eea00294dcd91888a63b96e9d8ed"
    },
    {
      "path": "contracts/ag-registry-status-v1.json",
      "sha256": "ec9520756f8c4516f2acd72dd4934f0087d31a5bfda7bb24f9d468a9f08d5011"
    },
    {
      "path": "contracts/ag-registry-xlsx-2019-deferred-v1.json",
      "sha256": "3d5ffb5b71b91cb97680f62521c0894948b7b2b47ab3c7413b52327eda77e9c4"
    },
    {
      "path": "contracts/capture-attempt-v2.schema.json",
      "sha256": "61e574523f395308479c1e08b774a9dbebb221670479900d0d59127b0ac03e58"
    },
    {
      "path": "contracts/capture-status-v1.schema.json",
      "sha256": "decb06e8aa972df0f167acec98eed5c83a762ec0e0f9a0cdc549be9a23371b83"
    },
    {
      "path": "contracts/capture-status-v2.schema.json",
      "sha256": "850b1eed6287335417ed5240386b5e2461626b9a2e0b73ed4de89b299d8784bc"
    },
    {
      "path": "contracts/capture-status-v3.schema.json",
      "sha256": "a1d0bcbb2aec5f0a0d4103932e8b84d9b191de0bed92c894f00c0a4c32fa603d"
    },
    {
      "path": "contracts/claim-support-v1.json",
      "sha256": "fdb2123e658a5b3fa293f4eac24106d93851155b2def227a47df30cdd78af8df"
    },
    {
      "path": "contracts/d1-d8-dispositions-v1.schema.json",
      "sha256": "f97f4305396e6f7584f7365d9ae6612477376e08243c91175151534b638d9a8b"
    },
    {
      "path": "contracts/dbt-input-catalog-v1.json",
      "sha256": "cb4544408249160bc24ec4f3f56ae2575fd924405e3a4aa3127bc2d571ff6040"
    },
    {
      "path": "contracts/dbt-input-catalog-v1.schema.json",
      "sha256": "40c5a8ef51bbb72df0054c506df13a18b6d6398169149deded7d0c138f5d8710"
    },
    {
      "path": "contracts/hosted-replay-driver-v1.schema.json",
      "sha256": "598f1a3ba42bcefb3f73c2e0abd86986f540f9b7653843ea48e1f8f665508e9f"
    },
    {
      "path": "contracts/hosted-replay-envelope-v1.schema.json",
      "sha256": "f3d42f5b06764e038b4a88ca4a2b7dea6ef05c17581f14fd530c8e2b1966963b"
    },
    {
      "path": "contracts/hosted-replay-public-v1.schema.json",
      "sha256": "cac0062b3a852596062094ab8b8b731b1c1a63aecb4264e5effa890913d21738"
    },
    {
      "path": "contracts/latest-transaction-pointer-v1.schema.json",
      "sha256": "07e082580d20e624f964bec49ca83094ea97ed6f805f882822d9ba79dc4260a7"